Product,Price,Brand
Home,,
Synthetic Leather |Lightweight|Comfort|Summer|Trendy|Wa...,₹499,aadi
"Lightweight,Comfort,Summer,Trendy,Walking,Outdoor,Styli...",₹523,aadi
Lightweight Faux Leather Police and Oxford Police Shoes...,₹597,Hot Deal
Hustle V2 Sneakers For Men,"₹1,480",
Warrior Original Jungle - Light Weight Trekking Shoes B...,"₹1,889",LIBERTY
High Tops For Men,"₹1,099",asian
Lace Up For Men,₹779,
CRYSTA PRO Running Shoes For Men,₹714,
CRYSTA PRO Running Shoes For Men,₹779,
"Firefly-118 Pink Sports,Gym,Traning,Walking Stylish Sli...",₹785,asian
Crystal-13 Beige sky Sports Transparent Sole Technology...,"₹1,479",asian
Zod Runner V3 IDP Casuals For Men,"₹1,480",
CRYSTA PRO Running Shoes For Men,₹779,
CyclonitePro Res Running Shoes For Men,"₹2,940",
M7-22509-Zebra Olive Big Black Running Shoes For Men,₹670,M7 By Metronaut
Fortune HOL-132E Formal Slip-on Shoes With PU Upper | P...,₹919,LIBERTY
SUPER SPEED Running Shoes For Men,"₹1,349",
INTER CEPTOR-3 Running Shoes For Men,₹798,Hot Deal
"Athleisure Shoes for Men | Cultured Round-Toe Shape, Cu...","₹1,774",
ALLEN Walking Shoes For Men,"₹1,216",CAMPUS
Women's Memory Foam Shoes for Walking Running Gym Train...,₹749,DOCTOR EXTRA SOFT
Base-Strike Running Shoes For Men,"₹1,548",
HURRICANE Running Shoes For Men,₹769,
Plush Comfort Running Shoes For Men,"₹1,299",
NASH E 24 Sneakers For Men,"₹1,754",Bata
8516: BEN PLAIN E Black Loafer Slip-On Casual Shoes for...,₹714,Bata
Alpha Predator High Tops For Men,"₹1,399",
"Action Athleo ATG-987 Light Weight,Comfortable,Trendy,R...",₹664,
F50 CLUB FxG Football Shoes For Men,"₹2,700",
Bellies For Women,₹879,Bata
